ID,translated,source-language,sentence,context,full-ratings,mean-ratings
14994,1,fr,"they are all masterworks, all of which have been innovative in their time, but they are not a particular style.","although these were objects of devotion, they did not begin a local tradition of sculpture.	rather, it was in the era of the holy roman emperor charles v (charles i of spain) that an initial nucleus of sculptors came together to work on sculptures for the capilla real.	the tomb of the catholic monarchs was the work of italian sculptor domenico fancelli; the tomb of joanna of castile and philip i of castile the work of bartolomé ordóñez; the great altarpiece was by felipe bigarny and pieces such as the ""incarnation"" and the ""entombment of christ""-now in the museum-by jacopo torni of florence.","3,3,4,4,4,4,4,4,3,3,4,4,3,4,3,4,4,4",3.6666666666666665
1506,1,de,the institution of slavery was abolished in 1923.,"he moved to end his country's traditional isolation by establishing diplomatic relations with the international community and, following a 1927–28 tour of europe and turkey, introduced several reforms intended to modernize his nation.	a key force behind these reforms was mahmud tarzi, an ardent supporter of the education of women.	he fought for article 68 of afghanistan's 1923 constitution, which made elementary education compulsory.","4,4,4,4,4,4,4,4,4,4,4,4,4,4,4,4,4,4",4.0
1606,1,de,the international service broadcasts of radio programmes in albanian and seven other languages on medium wave (i) and wave (sw).,"radio televizioni shqiptar (rtsh) is the public radio and tv broadcaster of albania, founded by king zog in 1938.	rtsh runs three analogue television stations as tvsh ""televizioni shqiptar"", four digital thematic stations as rtsh, and three radio stations using the name ""radio tirana"".	in addition, 4 regional radio stations serve in the four extremities of albania.","4,2,2,4,3,3,2,3,4,3,2,2,3,4,3,3,4,3,3",3.0
1687,1,de,"at that time, ueshiba on its martial arts as' aiki budō '.","ueshiba moved to hokkaidō in 1912, and began studying under takeda sokaku in 1915.	his official association with daitō-ryū continued until 1937.	however, during the latter part of that period, ueshiba had already begun to distance himself from takeda and the daitō-ryū.","2,2,1,1,2,1,2,2,1,2,1,3,1,2,1,3,1,3,3,1",1.75
1701,1,cs,"works of art, can be specifically for this purpose or interpreted on the basis of the images or objects.","within this latter sense, the word ""art"" may refer to several things: (i) a study of a creative skill, (ii) a process of using the creative skill, (iii) a product of the creative skill, or (iv) the audience's experience with the creative skill.	the creative arts (""art"" as discipline) are a collection of disciplines which produce ""artworks"" (""art"" as objects) that are compelled by a personal drive (art as activity) and convey a message, mood, or symbolism for the perceiver to interpret (art as experience).	art is something that stimulates an individual's thoughts, emotions, beliefs, or ideas through the senses.","4,4,3,2,4,4,4,3,2,3,2,4,2,2,3,3,4",3.1176470588235294
1791,1,cs,"for the british, war, has now become much more complicated.","saratoga was the turning point of the war.	revolutionary confidence and determination, suffering from howe's successful occupation of philadelphia, was renewed.	what is more important, the victory encouraged france to make an open alliance with the americans, after two years of semi-secret support.","3,4,3,4,4,3,4,3,4,4,3,3,4,4,4,4,4",3.6470588235294117
1855,1,de,"now the elegant 'computes example-numbers faster, whether for every a, b and research, this is always the case require a detailed analysis.","the speed of ""elegant"" can be improved by moving the b=0?	test outside of the two subtraction loops.	this change calls for the addition of 3 instructions (b=0?, a=0?, goto).","2,2,2,1,2,1,1,1,2,1,2,3,2,1,2,2,3,3,1,1",1.75
1861,1,es,"but i assume that could be done absolutely everything that can be expected of any logic rational machine. ""","but not to be outdone he too presented ""a plan somewhat analogous, i apprehend, to prof. jevon's ""abacus"" ...	[and] [a]gain, corresponding to prof. jevons's logical machine, the following contrivance may be described.	i prefer to call it merely a logical-diagram machine ...","1,2,3,2,4,4,3,2,3,4,2,2,2,3,4,3,1,3,2",2.6315789473684212
1892,1,fr,"when the thessalians realised the order of the day, they are alexander in their back and rapid cancellation, adding their alexander cavalry charge of force.","when news of the revolts reached alexander, he responded quickly.	though advised to use diplomacy, alexander mustered 3,000 macedonian cavalry and rode south towards thessaly.	he found the thessalian army occupying the pass between mount olympus and mount ossa, and ordered his men to ride over mount ossa.","2,1,3,2,3,1,1,1,3,1,1,1,2,3,2,1,1,2",1.7222222222222223
2011,1,fr,"his name is derived from the arabic word for 'lamb' or 'head of the ram' ('sick al-hamal'), which references aries mythological of substance.","all three are commonly used for navigation.	there is also one other star above the fourth magnitude, 41 arietis.	α arietis, called hamal, is the brightest star in aries.","3,4,4,4,4,4,4,3,3,3,3,4,4,4,3,3,4,3,4",3.5789473684210527
2263,1,cs,"in recent years, politicians actively discourage against campaign in minority languages.","the city has been at times marked by ethnic tension.	in 2004 film director theo van gogh was murdered by mohammed bouyeri in amsterdam.	among others, in line with attitude changes in dutch politics towards certain (especially islamic) minorities turkish-language and arabic-language tv channels have been dropped from the basic cable tv package.","3,3,3,3,2,3,3,4,3,3,2,3,2,3,3,4,4",3.0
2289,1,es,"at the time, a total of 15 municipalities have created.","the city of amsterdam is a municipality under the dutch municipalities act.	it is governed by a directly elected municipal council, a municipal executive board and a mayor.	since 1981, the municipality of amsterdam has gradually been divided into semi-autonomous boroughs, called ""stadsdelen"" or 'districts'.","3,2,2,2,3,3,3,2,3,2,3,2,3,2,4,3,1,4,1",2.526315789473684
2314,1,de,it is not clear how the shortcomings in the idle-stabilization system.,"with a series of recall campaigns, audi made several modifications; the first adjusted the distance between the brake and accelerator pedal on automatic-transmission models.	later repairs, of 250,000 cars dating back to 1978, added a device requiring the driver to press the brake pedal before shifting out of park.	a legacy of the audi 5000 and other reported cases of sudden unintended acceleration are intricate gear stick patterns and brake interlock mechanisms to prevent inadvertent shifting into forward or reverse.","2,2,3,2,3,3,3,3,2,3,2,3,3,2,3,2,3",2.588235294117647
2332,1,de,"audi also developed good branding instruments of certain instruments, solid issues, rhythm and it all sounds the audi solid character.","audi developed a corporate sound concept, with audi sound studio designed for producing the corporate sound.	the corporate sound project began with sound agency klangerfinder gmbh & co kg and s12 gmbh. audio samples were created in klangerfinder's sound studio in stuttgart, becoming part of audi sound studio collection.	other audi sound studio components include the brand music pool, the brand voice.","2,2,3,2,3,2,2,2,1,1,2,2,1,2,2,2,2,2,3",2.0
2350,1,es,"also on their behalf survive modern-day companies such as dynamit the nobel prize and akzonobel, which are descendants of mergers with companies.","nobel held 350 different patents, dynamite being the most famous.	his fortune was used posthumously to institute the nobel prizes.	the synthetic element nobelium was named after him.","3,2,1,1,3,3,2,1,1,1,1,1,3,3,1,2,3.0",1.8823529411764706
2387,1,cs,"in its recent, and some of its most productive age, bell division between his residence in washington d.c., where he and his family originally her for most of the year and beinn bhreagh are spent more time.","by 1889, a large house, christened ""the lodge"" was completed and two years later, a larger complex of buildings, including a new laboratory, were begun that the bells would name beinn bhreagh (gaelic: ""beautiful mountain"") after bell's ancestral scottish highlands.	bell also built the bell boatyard on the estate, employing up to 40 people building experimental craft as well as wartime lifeboats and workboats for the royal canadian navy and pleasure craft for the bell family.	an enthusiastic boater, bell and his family sailed a rowed a long series of vessels on bras d'or lake, ordering additional vessels from the h.w. embree and sons boatyard in port hawkesbury, nova scotia.","2,1,2,1,1,2,1,1,1,2,2,1,1,1,3,3,2,2",1.6111111111111112
2498,1,de,the governor of the state of massachusetts had collectively on the next day south trains.,"lincoln called on all the states to send forces to recapture the fort and other federal properties.	he cited presidential powers given by the militia acts of 1792.	with the scale of the rebellion apparently small so far, lincoln called for only 75,000 volunteers for 90 days.","2,1,2,2,2,2,1,2,2,2,1,2,3,2,2,1,2,1,3",1.8421052631578947
2515,1,es,"mcclellan and read fought in the battle of antietam near sharpsburg, maryland, 17 september, 1862, the bloodiest single day at the united states military history.","emboldened by second bull run, the confederacy made its first invasion of the north.	general lee led 45,000 men of the army of northern virginia across the potomac river into maryland on september 5.	lincoln then restored pope's troops to mcclellan.","3,3,4,4,4,3,4,3,3,3,3,4,4,4,4,3,3",3.4705882352941178
255,1,fr,"secondly, any sensory experience that comes when someone is asleep and is perceived by the person then asleep is not eligible under a dream.",aristotle also includes in his theory of dreams what constitutes a dream and what does not.	he claimed that a dream is first established by the fact that the person is asleep when they experience it.	if a person had an image appear for a moment after waking up or if they see something in the dark it is not considered a dream because they were awake when it occurred.,"3,4,2,3,3,4,4,3,4,4,4,3,2,3,3,4,3",3.2941176470588234
2589,1,es,"after the mid-1960s, became much less rich, but its work later — among its last two epics', kagemusha '(1980) and' addressed '(1985) — continued to win awards, including the' kagemusha ', although more often abroad that in japan.","""rashomon"", which premiered in tokyo in august 1950, and which also starred mifune, became, on september 10, 1951, the surprise winner of the golden lion at the venice film festival and was subsequently released in europe and north america.	the commercial and critical success of this film opened up western film markets for the first time to the products of the japanese film industry, which in turn led to international recognition for other japanese filmmakers.	throughout the 1950s and early 1960s, kurosawa directed approximately a film a year, including a number of highly regarded films such as ""ikiru"" (1952), ""seven samurai"" (1954) and ""yojimbo"" (1961).","1,2,3.0,3,3,2,3,1,3,3,2,2,2,3,3,2,3,4",2.5
2735,0,en,"however, on 10 february 1973, the song came third in melodifestivalen; thus it never reached the eurovision song contest itself.","in 1973, the band and their manager stig anderson decided to have another try at melodifestivalen, this time with the song ""ring ring"".	the studio sessions were handled by michael b. tretow, who experimented with a ""wall of sound"" production technique that became the wholly new sound.	stig anderson arranged an english translation of the lyrics by neil sedaka and phil cody and they thought this would be a surefire winner.","4,4,4,3,4,4,4,3,3,3,4,4,4,4,3,4",3.6875
2759,1,fr,for the album agnetha recorded duets with his son and with a chorus of children.,"in early 1987, agnetha recorded an album ""kom följ med i vår karusell	"" ('come ride with me on my carousel') with her son christian.	the album contained songs for children and was sung in swedish.","3,3,3,4,4,3,4,4,3,4,4,3,4,4,4,4,3,3",3.5555555555555554
2767,1,fr,"for me, however, were certified by the music industry association of america for the sale of over a million copies of all.","a total of four of those singles reached the top 10, including ""dancing queen"" which reached number-one in april 1977.	while ""fernando"" and ""sos"" did not break the top 10 on the ""billboard"" hot 100 chart, reaching number 13 and 15 respectively, they did reach the top 10 on cashbox (""fernando"") and record world (""sos"") charts.	both ""dancing queen"" and ""take a chance","1,2,1,2,2,1,2,3,3,2,3,2,2,2,3,3,3,3,2,1",2.15
2768,1,cs,"emigration to the uncivilized country leaves intact the british nationality: a right for all states to deal with their authority their issues, so that emigration is one of the usual and recognised by colonial enlargement.","by the naturalisation act 1870, it was made possible for british subjects to renounce their nationality and allegiance, and the ways in which that nationality is lost are defined.	so british subjects voluntarily naturalized in a foreign state are deemed aliens from the time of such naturalization, unless, in the case of persons naturalized before the passing of the act, they have declared their desire to remain british subjects within two years from the passing of the act.	persons who from having been born within british territory are british subjects, but who at birth became under the law of any foreign state subjects of such state, and also persons who though born abroad are british subjects by reason of parentage, may by declarations of alienage get rid of british nationality.","3,3,3,3,3,2,3,2,2,2,2,3,2,3,3",2.6
289,1,fr,"the more monitored ceremony based on ratings nielsen until now, however, the Academy 42nd distinctions (better scoreboard 'midnight cowboys'), which has attracted a 43.4% of households rating on 7 april 1970.","historically, the ""oscarcast"" has pulled in a bigger haul when box-office hits are favored to win the best picture trophy.	more than 57.25 million viewers tuned to the telecast for the 70th academy awards in 1998, the year of ""titanic"", which generated close to us$600 million at the north american box office pre-oscars.	the 76th academy awards ceremony in which """" (pre-telecast box office earnings of us$368 million) received 11 awards including best picture drew 43.56 million viewers.","3,3,1,1,3,3,2,1,1,1,2,1,3,4,3,2,3,3,2,2",2.2
2923,1,cs,"the least stable is astatine-214m1; its half-life from 265 nanoseconds is shorter than all the states, in addition to that of the astatine-213.","a nuclear isomer may also be called a ""meta-state"", meaning the system has more internal energy than the ""ground state"" (the state with the lowest possible internal energy), making the former likely to decay into the latter.	there may be more than one isomer for each isotope.	the most stable of these nuclear isomers is astatine-202m1, which has a half-life of about 3 minutes, longer than those of all the ground states bar those of isotopes 203–211 and 220.","3,4,3.0,3,3,3,3,4,4,4,3,3,4,3,4,3,4",3.411764705882353
301,1,es,the majority of the clocks are caesium watches; the definition of whether the second is written in terms of caesium.,tai as a time scale is a weighted average of the time kept by over 400 atomic clocks in over 50 national laboratories worldwide.	the clocks are compared using gps signals and two-way satellite time and frequency transfer.	due to the averaging it is far more stable than any clock would be alone (see signal averaging for a discussion).,"3,3,4,3,4,3,2,3,3,4,3,4,4,3,3,3,2,3",3.1666666666666665
310,1,cs,"however, when volunteers generously places the interests other than their own, charitable donations, further brain circulation was selectively activated: subgenual cortex / septal region.","jorge moll and jordan grafman, neuroscientists at the national institutes of health and labs	-d'or hospital network (j.m.) provided the first evidence for the neural bases of altruistic giving in normal healthy volunteers, using functional magnetic resonance imaging.	in their research, published in the proceedings of the national academy of sciences usa in october 2006, they showed that both pure monetary rewards and charitable donations activated the mesolimbic reward pathway, a primitive part of the brain that usually lights up in response to food and sex.","3,2,4,3,3,2,1,1,1,1,2,2,3,4,3,3,3,4,2,3",2.5
3184,1,es,these deficits were less serious than the seen similar of children with a diagnosis multiple sclerosis.,"a study of six children with adem (mean age at presentation 7.7 years) were tested for a range of neurocognitive tests after an average of 3.5 years of recovery.	all six children performed in the normal range on most tests, including verbal iq and performance iq, but performed at least one standard deviation below age norms in at least one cognitive domain, such as complex attention (one child), short-term memory (one child) and internalizing behaviour/affect (two children).	group means for each cognitive domain were all within one standard deviation of age norms, demonstrating that, as a group, they were normal.","1,2,3,2,3,2,4,4,2,3,3,3,2,4,4,3,1,4,1",2.6842105263157894
3194,1,cs,they can also hold the key to the pathogenesis.,early diagnosis and treatment with a gluten free diet can improve ataxia and prevent its progression.	readily available and sensitive markers of gluten ataxia include anti-gliadin antibodies.	immunoglobulin a (iga) deposits against transglutaminase 2 (tg2) in the small bowel and at extraintestinal sites are proving to be additionally reliable and perhaps more specific markers of the whole spectrum of gluten sensitivity.,"4,4,4,3,4,3,4,4,4,3,4,4,4,3,4,4",3.75
3242,1,de,high-water in streams and rivers peak in june and july in the snow on the high altitudes.,"the mean precipitation in the alps ranges from a low of per year to per year, with the higher levels occurring at high altitudes.	at altitudes between , snowfall begins in november and accumulates through to april or may when the melt begins.	snow lines vary from , above which the snow is permanent and the temperatures hover around the freezing point even july and august.","3,2,4,2,2,3,3,3,3,4,3,2,3,3,4,1,1,3",2.7222222222222223
3255,0,en,the 16th century switzerland was well-established as a separate state.,"much of the medieval period was a time of power struggles between competing dynasties such as the house of savoy, the visconti in northern italy and the house of habsburg in austria.	in 1291 to protect themselves from incursions by the habsburgs, four cantons in the middle of switzerland drew up a charter that is considered to be a declaration of independence from neighboring kingdoms.	after a series of battles fought in the 13th, 14th and 15th centuries, more cantons joined the confederacy and by","4,3,3,4,4,3,4,4,3,4,4,3,4,4,4,4,4,3,4,3",3.65
3320,1,de,"this issue was largely by the time the christie in the middle east, where it consistently religious temple and spiritual history of the cities that, during the gulf mallowan archaeological work.","one of the stronger influences is her love of the mystical and mysterious.	many of christie's books and short stories, set both in the middle east and back in england, have a decidedly otherworldly influence in which religious sects, sacrifices, ceremony, and seances play a part.	such stories include ""the hound of death"" and ""the idol house of astarte"".","3,1,2,2,1,3,1,2,1,1,2,3,3,1,1,1,1,2,3",1.7894736842105263
3349,1,de,the tension or the current was a 'analogue' of the sound.,"any information may be conveyed by an analog signal; often such a signal is a measured response to changes in physical phenomena, such as sound, light, temperature, position, or pressure.	the physical variable is converted to an analog signal by a transducer.	for example, in sound recording, fluctuations in air pressure (that is to say, sound) strike the diaphragm of a microphone which induces corresponding fluctuations in the current produced by a coil in an electromagnetic microphone, or the voltage produced by a condensor microphone.","3,4,4,3,4,3,4,4,4,4,3,4,3,4,4,3,4,4",3.6666666666666665
3541,1,es,"in january 1937, has returned to lambaréné and continue to work there during the second world war.","he was there again from 1929 to 1932.	gradually his opinions and concepts became acknowledged, not only in europe, but worldwide.	there was a further period of work in 1935.","3,2,3,2,4,3,3,2,4,2,3,4,4,4,2,2,3,2,3",2.8947368421052633
3571,0,en,"if the abscess does not heal only with incision and drainage, or if the abscess is in a place that is difficult to drain such as the face, hands, or genitals, then antibiotics may be indicated.","most people who have an uncomplicated skin abscess should not use antibiotics.	antibiotics in addition to standard incision and drainage is recommended in persons with severe abscesses, many sites of infection, rapid disease progression, the presence of cellulitis, symptoms indicating bacterial illness throughout the body, or a health condition causing immunosuppression.	people who are very young or very old may also need antibiotics.","4,4,3,4,4,4,4,3,4,3,4,3,4,3,4,4,4,4",3.7222222222222223
3667,1,cs,"the majority of almonds were to export as shelled almonds (70%), with the rest either unshelled or processed.","in the united states, production is concentrated in california, with almonds being california's third-leading agricultural product, its top agricultural export in 2008, and 100% of the u.s. commercial supply.	the united states is the dominant supplier of almonds.	in 2011, the country exported about 637,000 metric tons, valued at us$2.8 billion.","4,3,3,4,4,4,3,3,4,3,4,4,4,4,4,3.0",3.625
3738,0,en,"during the war, the azeri armed forces were also aided by turkish military advisers, and russian, ukrainian, chechen and afghan mercenaries.","the azeri armed forces took a series of devastating defeats by armenian forces during the 1992–1994 nagorno-karabakh war, which resulted in the loss of control of nagorno-karabakh proper and seven surrounding rayons, comprising roughly 16% of the territory of azerbaijan.	azerbaijani sources insist that armenian victory was largely due to military help from russia and the wealthy armenian diaspora.	armenians partially deny the allegation, claiming that russian side was equally supplying armenian and azerbaijani sides with weapons and mercenaries.","3,3,4,3,3,4,3,3,4,4,4,4,4,4,3,3,3,4,4",3.526315789473684
3763,1,cs,"the vast majority of energy produced with imported fuels, including gas and nuclear fuel from russia (for their nuclear plants.)","until independence, armenia's economy was based largely on industry—chemicals, electronic products, machinery, processed food, synthetic rubber and textiles; it was highly dependent on outside resources.	agriculture accounted for only 20% of net material product and 10% of employment before the breakup of the soviet union in 1991.	armenian mines produce copper, zinc, gold and lead.","3,3,3,3,4,4,4,3,4,3,3,3,3,3,4,4,3,3,4",3.3684210526315788
386,0,en,algeria has the second largest military in north africa with the largest defence budget in africa ($10 billion).,"total military personnel include 147,000 active, 150,000 reserve, and 187,000 paramilitary staff (2008 estimate).	service in the military is compulsory for men aged 19–30, for a total of 12 months.	the military expenditure was 4.3% of the gross domestic product (gdp) in 2012.","4,4,4,4,4,4,4,4,4,4,4,4,4,4,4",4.0
3880,1,de,"it analyses language in the framework of the anthropology, biology, development, geography, history, neurology, psychological and sociological.","linguistics look at individual languages and language in general.	it breaks language down and analyses its component parts: theory, sounds and their meaning, utterance usage, word origins, the history of words, the meaning of words and word combinations, sentence construction, basic construction beyond the sentence level, stylistics, and conversation.	it examines the above using statistics and modeling, and semantics.","2,3,3.0,4,2,3,4,3,3,4,3,4,3,4,4,3,3,4",3.2777777777777777
3892,1,fr,"however, spalding was known aggrandise its role in the great moments baseball.","america's national game is a book by albert spalding, published in 1911 detailing the early history of the sport of baseball.	much of the story is told first-hand, since spalding had been involved in the game, first as a player and later an administrator, since the 1850s.	in addition to his personal recollections, he had access to the records of henry chadwick, the game's first statistician and archivist.","1,1,1,2,2,1,3,2,2,1,3,1,2,1,2,2,3,2,1",1.736842105263158
3954,1,de,gawler pointed out and governor grey in 1841.,"governor gawler took over from hindmarsh in late 1838 and, despite being under orders from the ""select committee on south australia"" in britain not to undertake any public works, promptly oversaw construction of a governor's house, the adelaide gaol, police barracks, a hospital, a customs house and a wharf at port adelaide.	in addition, houses for public officials and missionaries and outstations for police and surveyors were also constructed during gawler's governorship.	adelaide had also become economically self-sufficient during this period, but at heavy cost: as a result of gawler's public works the colony was heavily in debt and relied on bail-outs from london to stay afloat.","1,2,2,2,1,1,1,1,3,1,3,1,1,3,2,1,2",1.6470588235294117
