ID,translated,source-language,sentence,context,full-ratings,mean-ratings
12895,1,cs,cohesion is thought bernays indicate that the existence of measurable cardinal.,"his reflection principle stated roughly that if ""a"" is a class with some property, then one can find a transitive set ""u"" such that ""a∩u"" has the same property when considered as a subset of the ""universe"" ""u"".	this is quite a powerful axiom and implies the existence of several of the smaller large cardinals, such as inaccessible cardinals.	(roughly speaking, the class of all ordinals in zfc is an inaccessible cardinal apart from the fact that it is not a set, and the reflection principle can then be used to show that there is a set which has the same property, in other words which is an inaccessible cardinal.)","2,1,1,3.0,1,3,1,3,1,1,2,1,3,2,2,2,3,1",1.8333333333333333
1290,1,de,"although the historian, in general, of the opinion that the article too weak, the fast-growing nation, you, the solution to the question of how the member states voluntarily in your country national control.","the peace treaty left the united states independent and at peace but with an unsettled governmental structure.	the articles envisioned a permanent confederation, but granted to the congress—the only federal institution—little power to finance itself or to ensure that its resolutions were enforced.	there was no president and no national court.","1,1,1,2,3,3,1,1,1,3,1,1,2,1,1,1,3,2",1.6111111111111112
12957,0,en,"the powers whiskey sponsorship is backed up by the irish branch of pernod ricard, a sponsorship existing since 1960 and the longest sponsorship in irish racing.","fairyhouse is owned by horse racing ireland (hri) and was managed by doneraile man dick sheil, a graduate of warrenstown agricultural college and ucd from 1999 until october 2006, one year after ownership passed hands from fairyhouse club ltd owing to financial difficulties.	hri viewed dick sheil as a tremendous asset to the course having brokered considerable sponsorship and managing many major meetings.	the course was overseen by a caretaker manager for almost a year and on october 1, 2007 the position was filled by chartered accountant caroline gray who had worked for the hri finance department for five years previously and was described as an ""innovator"" by hri.","4,3,4,4,3,4,4,3,4,3,4,3,4,4,4,4",3.6875
12981,1,de,"jelly roll morton also said, written level, based on the jazzed version of the old french quadrille.","a number of veterans of papa jack laine's band said the tune had been known in new orleans as ""number two"" long before the dixieland jass band copyrighted it.	in one interview, papa jack laine said that the actual composer of the number was achille baquet.	punch miller claimed to have originated the cornet & trombone breaks with jack carey, and that from carey's characteristic growl many locals called the tune ""play jack carey"".","1,3,2,2,3,2,2,1,2,2,3,2,2,1,3,1,2,2,3,1",2.0
13021,1,es,now serves as john franklin science centre.,"dobbs was an employee of coca-cola business tycoon asa griggs candler's.	dobbs had served as coca-cola's first salesman and eventually became the advertising manager and president of the company.	this building, originally designed by atlanta architect t. j. mitchell, was renovated and added onto in 1997.","2,2,3,4,3,4,3,4,3,2,4,4,4,3,2,3,2",3.0588235294117645
13041,0,en,the supreme court of arizona upheld the argument.,"the charges included three counts of misdemeanor assault, five of contributing to the delinquency of a minor and two of indecent exposure.	the number of counts was reduced to seven when one of the victims died.	a lengthy appellate process ensued when fushek's lawyers argued that he was entitled to a jury trial on the remaining counts as opposed to one or more bench trials.","4,4,4,4,4,4,4,4,4,4,4,4,4,4,4,4,4,4",4.0
13043,1,de,this j. j. winckelmann tucked away.,"cardinal alessandro albani had another villa and park at porto d'anzio, that was finished in february 1732, but was habitable for a few weeks only in spring because of malaria.	perhaps the villa, and certainly a casina in the park were by marchionni.	excavations in the park brought to light many ancient roman sculptures.","1,1,3,3,1,3,3,1,1,2,1,2,1,2,1,3,1,3,2,2",1.85
13084,1,es,"maui survives the volcano and the islanders send through the 'test maui duckhood', that is, to win the confidence of the native people.","maui mallard is a ""medium-boiled"" detective visiting a tropical island when the mysterious shabuhm shabuhm idol goes missing.	shabuhm shabuhm is considered the island's native guardian spirit, and unless the idol is recovered, the whole island will explode.	maui is put on the case, and his investigations lead him through a creepy mansion to a native village, where maui is thrown into a volcano as a sacrifice to the native gods.","3,2,3.0,4,2,2,4,3,4,3,2,2,4,2,3,3,3",2.8823529411764706
13128,0,en,they are the largest youth employer in kugluktuk.,"the high school, through the ""kugluktuk high school athletics association"" also known as the ""kugluktuk grizzlies"", has created a non-profit, stay-in-school organization that uses sport and recreation opportunities as incentives for staying in school, and making healthy lifestyle choices.	currently, the membership has over 100 students.	through a variety of fundraisers, they provide the youth in kugluktuk with opportunities in various things such as sport and employment.","4,4,4,4,4,4,4,4,4,4,4,4,4,4,4,4,4",4.0
13167,1,es,"mathis played with aeroplanes until 1994, starting with two games and make four touchdowns total.","the following year, he played in all sixteen games for the jets, starting one.	he had 28 receptions for 329 yards and one touchdown.	he led the team in kickoff returns, piling up 599 yards.","2,2,3,2,3,1,2,3,3,1,2,4,3,3,3,2,3,3",2.5
13188,1,es,asch worked as director of the cva until his death in 1994.,"the cva was founded and directed by ira abrams in collaboration with barbara myerhoff.	tim asch took over as director of the cva in 1983.	in 1984, he collaborated with the usc school of cinematic arts to create the mava degree (master of arts in visual anthropology), a 2-3 year terminal masters program unique in its emphasis on both textual and visual media (film and photography) as components of an academically grounded research project.","4,4,4,4,4,4,4,4,4,4,4,4,4,4,4,4,4",4.0
13310,1,es,the district lies in the southwestern corner of madhya pradesh; the narmada river forms its northern border.,"barwani district () is one of the districts of madhya pradesh state of india.	the administrative headquarters of the district is at barwani.	barwani district has an area of 3665 km² and a population 1,081,039 (2001 census).","4,4,4,4,4,4,4,4,4,4,4,4,4,4,4,4,4",4.0
13390,1,fr,following the reorganisation of the States on 1 november 1956,"the area covered by this district was part of the princely state of orchha till its merger with the indian union.	the orchha state was founded by rudra pratap singh in 1501.	after merger, it became one of the eight districts of vindhya pradesh state in 1948.","3,3,4,4,3,4,3,4,4,4,3,3,4,4,3,3,3",3.4705882352941178
13403,0,en,the most common language is malvi (rajasthani and hindi mixed).,mandsaur is rich in archaeological and historical heritage	but what makes it famous is the temple of lord pashupatinath located on the bank of shivna.	its idol has parallel only in nepal.,"4,4,4,4,4,4,4,4,4,4,4,4,4,4,4,4,4,4",4.0
13423,1,fr,the region is part of ujjain division.,"it is bounded by mandsaur district to the north, jhalawar district of rajasthan state to the northwest, ujjain district to the west, dhar district to the south,	jhabua district to the southeast, and chittorgarh district of rajasthan to the east.	it is divided into five tehsils and is home to 9 towns and 1063 villages (as of 2001).","4,4,4,4,3,4,4,4,3,3,4,4,4,3,3,4,4",3.7058823529411766
13482,1,es,pluralism is quite inaccurate and is in fact only one building.,"like the other prudential commissions, the building is noted for its use of red architectural terracotta and brick.	it has a tower which was added to the building by the architect's son paul waterhouse in 1905.	exterior tiles between the first and second floor of the building read ""prudential assurance buildings"",","2,3,3,3,3,3,3,3,4,3,3,4,4,4,2,3,3,3",3.111111111111111
13541,1,cs,"the divisional level, divisional the development committee chaired by the prefect and violated mayors, representatives and private individuals.","planning at the national level was carried out by the ministry of planning and territorial development.	together with its various departments the ministry was responsible for planning medium and long term development.	at the provincial level,the economic service collected, centralised and handed data to the governor and the minister and also organised social development plans at the provincial planning board.","1,1,3,1,3,3,2,2,1,3,1,1,3,2,2,1,2",1.8823529411764706
13621,1,de,a local authority only belong to a common authority.,combined authorities consist of two or more contiguous english local government areas.	the creation of a combined authority is voluntary and all local authorities within the area must give their consent before it can be created.	the local authority of any district of england outside greater london can join a combined authority and a county council can become part of a combined authority even if only some of the non-metropolitan districts that make up the county are within the combined authority area.,"3,3,3,4,4,3,2,3,2,3,3,4,3,3,2,4",3.0625
13716,1,cs,this leads to gemmler retroactive payments.,"tom goes to the chemical plant to retrieve the formula, and gives it tor robert.	he in turn brings the formula to his meeting with linda and is escorted to gemmler's office.	suddenly tom appears at gemmler's office and starts arguing over the payment.","1,4,3,2,3,2,1,2,4,3,4,4,2,3,3,3,3",2.764705882352941
13907,1,es,your proposal for a court of rooms in ireland was accepted and became its first master.,"he settled in ireland about the close of the reign of queen elizabeth i, being a commissioner of plantations, and obtained very considerable territorial grants from the crown.	in 1602, parsons as surveyor general of ireland; in 1610 he obtained a pension of £30 (english) per annum for life.	in 1611, he was joined with his younger brother laurence in the supervisorship of the crown lands, with a fee of £60 per annum for life.","3,3,3,3,2,3,3,4,3,3,3,2,3,2,3,2,3,4",2.888888888888889
14000,1,es,this work has been subject to speak in the seminar bourbaki.,"the volume formula, together with number-theoretic and bruhat-tits theoretic considerations led to a classification, by gopal prasad and sai-kee yeung, of fake projective planes (in the theory of smooth projective complex surfaces) into 28 non-empty classes [21] (see also [22] and [23]).	this classification, together with computations by donald cartwright and tim steger, has led to a complete list of fake projective planes.	this list consists of exactly 50 fake projective planes, up to isometry (distributed among the 28 classes).","4,3,3,3,4,3,2,2,3,2,3,4,2,4,3,3,3,4",3.0555555555555554
14034,1,de,the hairy-eared dwarf lemur ('allocebus trichotis') was only five museum specimens known in the late nineteenth century and 1965.,"the arrival of humans on the island 1,500 to 2,000 years ago has taken a significant toll, not only on the size of lemur populations, but also on their diversity.	due to habitat destruction and hunting, at least 17 species and 8 genera have gone extinct and the populations of all species have decreased.	a couple of species once thought to have gone extinct have since been rediscovered.","3,3,3,3,3,3,4,2,2,3,3,2,4,4,3,3,3,3,3",3.0
14066,0,en,"in the same year, his mother and his wife, berenguela (berengaria), witnessed its foundation charter.","she gave ponce two daughters, beatriz and sancha, and two sons, fernando ""el mayor"" and guerau.	his daughter sancha married vela gutiérrez.	in 1145, ponce gave the government of his catalan viscounties to guerau (giraldo), who immediately set to work founding the monastery of santa maria de roca rossa.","4,3,4,4,4,4,4,3,3,4,4,3,3,4,3,4,3,3",3.5555555555555554
14088,1,de,"however, it was claimed that the office is named for col. henry.","this location was a celebrated crossing of the southern indians of the arkansas valley.	there was a practicle (sic) ford of the arkansas near here and the trails all centered here an it had been an important point during all the time i was in command of the plains.	from camp dodge, when a permanent post was ordered there, they named it fort dodge and after the war when the fort was abandoned, a city had grown up there, which is now known as dodge city."" .","4,4,4,4,3,4,4,3,4,4,3,4,4,4,3,3,4",3.7058823529411766
14093,0,en,the area includes land enclosed by sea dikes with fringing marshes.,the buffer zone has a total area of 8.000 hectares.	the park is a delta and estuary islands	(ba lat river-mouth) support coastal mangroves and the mud flat ecosystem in the red river delta.,"4,4,4,4,4,4,4,4,4,4,4,4,4,4,4,4",4.0
14126,1,cs,"then contribute to its vocals' fair lady ', one of the tracks in the lee seung-hwan the 20th anniversary of the hwantastic album' friends'.","the following year, her breakout role came in the critically lauded black comedy ""crush and blush"" for which she received considerable attention and numerous awards.	in 2009 seo woo took on the lead role in the cult favorite	""tamra, the island"", a period drama set on jeju island.","2,1,2,4,3,2,1,1,2,3,2,1,3,1,3,4,3,3,1",2.210526315789474
1413,1,de,"calgary, a 56% a white christmas, while edmonton has an 86%.","in southwestern alberta, the cold winters are frequently interrupted by warm, dry chinook winds blowing from the mountains, which can propel temperatures upward from frigid conditions to well above the freezing point in a very short period.	during one chinook recorded at pincher creek, temperatures soared from in just one hour.	the region around lethbridge has the most chinooks, averaging 30 to 35 chinook days per year.","2,3,1,2,2,3,2,2,2,2,1,3,1,3,1,3.0",2.0625
14160,0,en,"the semi-arid coastal areas of southern vietnam are the most arid in vietnam, so the vegetation also has high value as a source of germ plasm for restoring other areas that become drier or are affected by sea level rises due to climate change.","núi chúa national park is located in the south-eastern part of the great annamites ecoregion, one of the four global ecoregions identified by the world wildlife fund in the southern region of vietnam.	it is made up of the terrestrial ecoregions of southern vietnam lowland dry forests and southern annamite montane rain forests.	there are few, if any, opportunities to expand the areas of the three special use forests in this dry coastal forest ecoregion, so strict protection of the existing resources is imperative.","4,2,3,3,4,2,4,3,4,4,4,2,4,4,4,4,3,3,4,4",3.45
14250,1,fr,"agesander of rhodes, with two other rhodian sculptors, shared the famous' group laocoön ', vatican museums and the sculptures rediscovered to sperlonga in the villa of tiberius, probably at the beginning of the period imperial.","its famous schools of philosophy, science, literature and rhetoric shared masters with alexandria:	the athenian rhetorician aeschines, who formed a school at rhodes; apollonius of rhodes; the observations and works of the astronomers hipparchus and geminus, the rhetorician dionysius thrax.	its school of sculptors developed, under pergamese influence, a rich, dramatic style that can be characterized as ""hellenistic baroque"".","1,2,1,4,2,2,2,2,1,2,2,2,3,3,4,3,4,3,3",2.4210526315789473
14279,1,cs,"there are significant differences in the number of suicides, year after year, between the indian cities.","there were 19,120 suicides in india's largest 53 cities.	in the year 2012, chennai reported the highest total number of suicides at 2,183, followed by bengaluru (1,989), delhi (1,397) and mumbai (1,296).	jabalpur (madhya pradesh) followed by kollam (kerala) reported the highest rate of suicides 45.1 and 40.5 per 100,000 people respectively, about 4 times higher than national average rate.","4,4,4,4,4,4,4,4,4,4,4,4,4,4,4,4",4.0
14290,1,es,it was also a member of the council of 1993 to 1995 and other councils at local and regional level.,she was born and grew up in eastern oslo.	she was a member of lørenskog municipal council from 1994 to 1995 and of the executive committee in lørenskog from 1997 to 1998.	from 1995 to 1998 she was a member of akershus county council.,"2,3,3,3,3,3,2,2,4,3,4,3,3,3,4,3,3",3.0
14299,1,fr,"in january 2010 choi concluded with a new agency mcloud entertainment and has announced plans on the march 2 to resume activities in the first half of the year, but its approach to return to his stress and increasingly frustrated that it had not throw itself into any tv series.","suffering from depression after his sister's death, choi canceled engagements for more than a year.	friends later said he made several suicide attempts and had his stomach pumped for a drug overdose in 2009.	refusing his mother's pleas that he see a doctor, choi relied instead on nonprescription tranquilizers he bought from a pharmacy.","3,3,3,1,2,1,2,1,2,2,3,3,3,2,2,2,2,3,2",2.210526315789474
14332,1,de,"its implementation will lead to further overloading of the social and psychological staff (and, together with the cf. administration), the amount of work already, as the main objective of this service “voluntary-compulsory ” associations of convicted, based on common interests, to resolve the everyday problems through self-governance.","the special document regulating the operation of these organizations is a requirement of the cc of ukraine.	so far it was not met, causing the criticism on behalf of the experts.	the analysis of the document, however, shows that its norms are rather declarative, unrealistic and hardly feasible in practice.","3,3,2,2,3,2,2,2,2,3,3,3,2,2,3,3,2",2.4705882352941178
14351,1,es,"and, to judge by the information provided by the release spsu, the agency does not intend to comply cpc of ukraine in relation to the decision of the court.","on october 30, the circuit court of kyiv passed a decision refusing to satisfy in the full scope the claim of yu.	tymoshenko against the spsu actions.	specifically, the court sustained that the system of video-observation installed by the spsu in the premises where the convicts are kept, is legal.","3,2,3,3,4,2,4,2,3,3,3,3,4,2,4,3,4,2,2",2.9473684210526314
14391,0,en,"in 2010, they had a sold-out run in london, england where they became the highest-selling act ever to play the soho theatre.","their first three original shows premiered at the tricklock company performance space in albuquerque, new mexico.	in 2004, they took a show to the edinburgh fringe festival, where they were nominated for the perrier best newcomer award.	since then, they have performed on the fringe festival circuit in canada, and at the melbourne international comedy festival, the sydney comedy festival, the edinburgh fringe festival, and more.","4,3,4,3,3,4,4,4,4,4,4,4,4,4,4,3,4,4,4",3.789473684210526
14424,1,cs,"they are two eggs, and dragons is adopted.","he is noticeably smaller than most other dragons portrayed in the series; a characteristic that aids him in the first game.	in the original series, most dragons are depicted as bipedal; however, spyro is depicted as quadrupedal.	in the newer series, his back-story was that two thieves were running through the dragon realms and the dragons stopped them.","1,2,2,2,2,1,1,2,1,2,1,2,1,2,1,1,2,2,2",1.5789473684210527
14455,1,es,"lord elwyn-jones also expressed that if a crime could be undertaken recklessly, was one of the intentions.","lord simon's judgement in the same case advanced a different definition: crimes of specific intent required a ""purposive element"".	the court in ""heard"" considered a specific intent one which fitted either possible definition.	however, murder is again an exception: it can be committed not by intent but by virtual certainty.","3,3,3,2,3,3,2,3,2,2,3,2,3,2,3,2,3,3,2",2.5789473684210527
14470,1,de,"he said that the stairs and lifting ""orbit 'less more clearly than the previous kapoor function successfully, but ultimately he said' difficult to see what the big idea, the idea of a great thing. '","he speculated that the project might mark the time when society stops using large iconic projects as a tool for lifting areas out of deprivation.	he questioned its ability to draw people's attention to stratford after the games, in a similar manner to the successes of the angel of the north or the guggenheim museum bilbao.	he also questioned the piece's ability to strike a chord like the angel, which he believed had at least ""created a feelgood factor and sense of pride"" in gateshead, or whether it would simply become one of the ""many more unloved rotting wrecks that no one has the nerve to demolish"".","1,2,2,1,1,2,1,2,2,2,3,3,2,1,1,2",1.75
14478,0,en,"the romanesque house at 166 has a finely detailed corbelled brick cornice with its date of construction, 1883, in cast iron letters below.","equestrian symbols such as saddle pouches, horse heads and reins are carved into their ground floors.	their galvanized iron friezes are further decorated with embossed garlands and rosettes.	the neighboring building at 165 east 73rd is a beaux-arts style building in yellow roman brick with foliate carvings.","4,4,4,4,4,4,4,4,4,4,4,4,3,4,3,4,3,3,4,4",3.8
14546,1,fr,"hermann begemann was captured by Soviet troops after the battle of stalingrad, it has been up in 1948.",hermann begemann (23 february 1896 – 4 july 1965) was a highly decorated oberst in the wehrmacht during world war ii.	he was also a recipient of the knight's cross of the iron cross.	the knight's cross of the iron cross was awarded to recognise extreme battlefield bravery or successful military leadership.,"3,2,3,3,3,2,2,3,3,3,2,3,3,3,2,3,3.0",2.7058823529411766
14634,0,en,"he was transferred back to the infantry for two years from 1893, before returning to the ecole.","félix lucien roger debax (28 september 1864 – 25 august 1914) was a french army officer and olympic fencer.	born in toulouse, debax entered the army as an officer-candidate at the age of 18.	after service with the infantry (where he was promoted to the rank of captain), he became attached to the army gymnastics school (ecole normale de gymnastique) in 1889.","4,3,4,3,4,4,4,3,4,3,4,4,3,4,4,4,4,3",3.6666666666666665
14742,1,fr,its multi-gym has a wide range of a modern equipment installed.,wellacre academy stands in grounds which contain eleven hectares of playing fields including an all weather cricket pitch.	a full sized artificial pitch with floodlighting was completed in spring 2005.	it possesses two modern gymnasia each with a separate suite of showers and changing rooms.,"4,3,4,4,4,3,4,4,3,4,3,4,3,3,4,3,4",3.588235294117647
14753,0,en,"and she was an active member of the kentucky medical association, the jefferson county medical society, and the tri-county medical society.","she was an active member of the american association for the advancement of science.	she was the first women to hold the position of vice president with the american medical association.	she was president of the association of southern medical women, and councilor of the american association of medical women.","4,4,4,4,4,4,4,4,4,4,4,4,4,4,4,4,4,4",4.0
1477,0,en,"einstein once wrote: ""i do not believe in a personal god and i have never denied this but expressed it clearly"".","einstein's views about religious belief have been collected from interviews and original writings.	he called himself an agnostic, while disassociating himself from the label atheist.	he said he believed in the ""pantheistic"" god of baruch spinoza, but not in a personal god, a belief he criticized.","4,4,4,4,4,4,3,4,4,4,4,4,3,4,4,4,3,3,3",3.736842105263158
14791,1,de,representatives of mr mitchell ashley (r-ohio) if legislation proposed that the organisation of the territory was adopted by the congress of the united states in 1864.,"this is a list of mountain ranges in the state of montana.	montana is the fourth largest state in the united states and is well known for its mountains.	the name ""montana"" means mountain in the spanish language.","2,2,2,3,3,3,3,2,3,3,3,2,3,2,3,2,2",2.5294117647058822
14856,0,en,"the first ten cars were flagged away at the start by the first minister of scotland, rt hon alex salmond and sir jackie stewart.","the 2009 rally scotland, 1st rally scotland was the 11th and final round of the 2009 intercontinental rally challenge.	the event was held between 19–21 november during some of the wettest weather seen in the uk.	the rally was officially started at the historic site of scone palace on thursday 19th and concluded with a ceremonial finish at stirling castle on saturday 21st.","4,2,4,4,3,4,4,2,2,4,4,3,3,4,4,3,3,4",3.388888888888889
14922,1,de,tuhus was in the norwegian ministry broadcasting corporation nrk drama 'between 1994 and 2000.,"his film debut was ""rødblått paradis"" from 1971.	his ""maria marusjka"" from 1973 was awarded the norwegian film critics' prize.	his film ""streik!"" from 1974, based on a novel by tor obrestad, was presented at the cannes film festival.","3,3,3,3.0,4,3,3,3,4,3,3,3,3,3,3,4,3,3,4",3.210526315789474
14982,0,en,"as of the 2010 census, its population is 306.comfort is the home of sherman elementary school.","comfort is a census-designated place (cdp) in boone county, west virginia, united states.	comfort is located on west virginia route 3 northeast of madison.	comfort has a post office with zip code 25049.","2,4,3,2,2,3,3,4,4,3,3,4,4,2,3,4,3,3,4",3.1578947368421053
