ID,translated,source-language,sentence,context,full-ratings,mean-ratings
6311,1,cs,"the adverse results temporarily halt republican calls to impeach johnson, who was elated before the elections.","although republicans expressed anger with his actions, the 1867 elections generally went democratic.	no seats in congress were directly elected in the polling, but the democrats took control of the ohio general assembly, allowing them to defeat for re-election one of johnson's strongest opponents, senator benjamin wade.	voters in ohio, connecticut, and minnesota turned down propositions to grant african-americans the vote.","3,4,4,3,4,3,3,4,4,4,4,3,3,3,4,3,4,4,3",3.526315789473684
6359,1,cs,while many ports have suffered a decline aberdeen is still busy because of the oil trade and influx of persons associated with industry and the consequent increase in property prices brought prosperity in this area.,"by late 1975, after years of intense construction the necessary infrastructure was in place.	in aberdeen, at bp's (british petroleum) headquarters, the queen pressed the button that would set the whole thing moving.	oil flowed from the rig directly to the refinery at far-away grangemouth.","4,3,4,4,3,3,3,4,4,3,3,3,3,3,4,3,3",3.3529411764705883
6421,1,es,such a small clashes with independent viking raiders would have happened during much of the period had for decades.,"alfred was still forced to contend with a number of danish threats.	a year later in 881 alfred fought a small sea battle against four danish ships ""on the high seas"".	two of the ships were destroyed and the others surrendered to alfred's forces.","2,1,1,4,3,2,2,3,2,3,2,4,2,3,2,3",2.4375
6478,0,en,"it should also include a hospital complex, a care, centre, a hotel zone, an urban centre and a thermal spa with villas and apartments.","the third project will relate to restructuring an area of algiers, qualified by the originators of the project of ""city of wellness"".	el abbar indicated to the journalists that the complex would be ""agréable for all those which will want to combine tourism and wellbeing or tourism and relaxation"".	the complex will include a university, a research center and a medical centre.","3,3.0,4,4,4,4,3,3,3,3,4,3,3,3,3,3,4",3.3529411764705883
6518,1,de,"age can also on the basis of the nature of the calendar, as the lunar timetable, as birth data in leap years, or the method after birth date.","the threshold age for engaging in sexual activity varies between jurisdictions (see below).	most jurisdictions have set a fixed age of consent.	however, some jurisdictions permit sex with a person after their puberty, such as the state of nayarit (in mexico) (and yemen, but only in marriage).","1,1,3,3,3,1,2,4,1,2,3,4,4,1,1,2,3,2,2,1",2.2
6563,1,fr,"victoria met maria christina and alfonso in biarritz, france later this month, and turn to catholicism in san sebastián in motion.","victoria was willing to change her religion, and her being a haemophilia carrier was only a possibility.	maria christina was eventually persuaded to drop her opposition.	in january 1906 she wrote an official letter to princess beatrice proposing the match.","4,2,3,3,3,2,2,2,2,2,3,2,3,3,4,2,4,2,2,3",2.65
6564,1,fr,"as the marriage procession of new palace, he threw a bomb against a window which killed and injured several spectators and members of the procession.","in may, diplomats of both kingdoms officially executed the agreement of marriage.	alfonso and victoria were married at the royal monastery of san jerónimo in madrid on 31 may 1906, with british royalty in attendance, including victoria's cousins the prince and princess of wales (later king george v and queen mary).	the wedding was marred by an assassination attempt on alfonso and victoria by catalan anarchist mateu morral.","3,3,4,2,3,3,2,3,3,2,3,2,3,3,3,2,4,4",2.888888888888889
6575,0,en,"in 1123, he besieged and took lleida, which was in the hands of the count of barcelona.","in 1119, he retook cervera, tudejen, castellón, tarazona, ágreda, magallón, borja, alagón, novillas, mallén, rueda, épila and populated the region of soria.	he began the siege of calatayud, but left to defeat the army at cutanda trying to retake zaragoza.	when calatayud fell, he took bubierca, alhama de aragón, ariza, and daroca (1120).","4,4,4,4,3,4,4,4,3,4,4,4,4,4,4,4,3,4,3",3.789473684210526
6587,1,cs,the plant is a core borer parasite lily brithys crini and / or diaphone eumela.,"the plant has a symbiotic relationship with carpenter bees.	it is also visited by noctuid moths at night.	the relative importance of these animals as pollinators has not yet been established; however, carpenter bees are thought to be the main pollinators of amaryllis on the cape peninsula.","3,2,2,1,4,2,2,4,3,2,3,3,3,4,2,1,1,2",2.4444444444444446
6605,1,es,"the acropolis, the temple of aphrodite, the market, the city ’ the walls, the church and the port were digging.","it was made from a single stone and has four curved handles bearing the head of a bull.	in the 1870s luigi palma di cesnola carried out excavations in the necropolis of amathus, as elsewhere in cyprus, enriching the early collections of the metropolitan museum of art; some objects went to the british museum.	more modern archaeological joint cypriote-french excavations started in 1980 and continue.","3,3,2,2,2,1,2,2,2,3,3,1,3,3,2,3,2",2.2941176470588234
6616,1,es,"during this time, women have not only had to defend itself, but to reproduce, and this may be the source of the idea that amazons covered once a year with its neighbours, if herodotus really based their accounts in reality.","up to 25% of military burials were of armed sarmatian women usually including bows.	russian archaeologist [[vera kovalevskaya]] points out that when scythian men were away fighting or hunting, nomadic women would have to be able to defend themselves, their animals and pasture-grounds competently.	during the time that the scythians advanced into asia and achieved near-[[hegemony]] in the near east, there was a period of twenty-eight years when the men would have been away on campaigns for long periods.","2,3,1,3,2,2,2,2,3,3,1,1,2,3,3,2",2.1875
6733,1,cs,their cruelty is denounced by the prophet amos,"they were subdued and paid tribute to jotham.	after submitting to tiglath-pileser they were generally tributary to assyria, but have joined in the general uprising that took place under sennacherib; but they submitted and they became tributary in the reign of esar-haddon.	their hostility to judah is shown in their joining the chaldeans to destroy it (2 kings 24:2).","4,4,4,4,4,4,4,4,4,4,4,4,4,4,4,3.0",3.9375
6748,1,cs,"alexander three finest admirals, nearchos, androsthenes and laomedon, her and after alexander death, his wife roxane and their small son alexander iv were in exile and later murdered.","the seat of the municipality is rodolivos.	amphipolis was a rich city (polis) in ancient macedonia.	it was famous for events such as the battle of the spartans and athenians in 424bc, and as the place where alexander the great prepared for campaigns leading to his invasion of asia.","3,3,2,2,3,3,2,1,1,1,1,2,3,2,1,2,2,3,2",2.0526315789473686
676,1,es,the enzyme chitinase produced in the stomach aid to digest the chitinous cuticle of arthropod dam.,"some use inertial feeding to help them swallow the prey, repeatedly thrusting their head forward sharply causing the food to move backwards in their mouth by inertia.	most amphibians swallow their prey whole without much chewing so they possess voluminous stomachs.	the short oesophagus is lined with cilia that help to move the food to the stomach and mucus produced by glands in the mouth and pharynx eases its passage.","2,3,3,2,3,3,3,4,4,2,3,4,3,3,3",3.0
692,1,es,"eyes and hair grow quickly, and one language is formed.","at metamorphosis, rapid changes in the body take place as the lifestyle of the frog changes completely.	the spiral‐shaped mouth with horny tooth ridges is reabsorbed together with the spiral gut.	the animal develops a large jaw, and its gills disappear along with its gill sac.","2,4,4,3,4,3,4,4,3,3,4,3,2,4,3,3,3,3",3.2777777777777777
6921,1,fr,"in the mid-5th century, the number of adults male citizens may be as high as 60, 000, but the number has decreased peloponnesian precipitously during the war.","estimates of the population of ancient athens vary.	during the 4th century bc, there might well have been some 250,000–300,000 people in attica.	citizen families could have amounted to 100,000 people and out of these some 30,000 would have been the adult male citizens entitled to vote in the assembly.","3,3,2,4,2,2,3,4,4,3,4,4,3,3,2,2,3",3.0
7170,1,fr,"the Academy of Sciences was re-established in motion 1816. lazare carnot and gaspard monge were removed from this college for political reasons, and the King appointed cauchy to take the place of one of them.","the next three years augustin-louis was mainly on unpaid sick leave, and spent his time quite fruitfully, working on mathematics (on the related topics of symmetric functions, the symmetric group and the theory of higher-order algebraic equations).	he attempted admission to the first class of the institut de france but failed on three different occasions between 1813 and 1815.	in 1815 napoleon was defeated at waterloo, and the newly installed bourbon king louis xviii took the restoration in hand.","4,4,4,3,4,3,3,3,3,4,2,3,3,3,4,2",3.25
7258,0,en,"in the southwest, the zambezi system interlaces with that of the taukhe (or tioghe), from which it at times receives surplus water.","the main stream has its rise in 11°21′3″ s 24°22′ e, at an elevation of .	it flows to the west and south for a considerable distance before turning eastward.	all the largest tributaries, including the shire, the outflow of lake nyasa, flow down the southern slopes of the band of high ground stretching across the continent from 10° to 12° s.","4,3,4,3,3,4,4,4,4,4,4,4,3,3,4,4,4",3.7058823529411766
7307,1,de,the bell is located in the south-eastern part of the sun devil stadium in the vicinity of the access of the students.,"the rotc cadets associated with the university are responsible for the transportation of the bell to various events and for ringing the bell after games are won by the sun devils.	the first victory bell, in various forms, was used in the 1930s but the tradition faded in the 1970s when the bell in use was removed from memorial union for renovations.	the bell cracked and was no longer capable of ringing.","3,3,3,3,4,4,3,4,4,3,3,3,3,4,3,3,3,4",3.3333333333333335
731,0,en,"the tsimshian people came to alaska from british columbia in 1887, when president grover cleveland, and later the u.s. congress, granted them permission to settle on annette island and found the town of metlakatla.","linguistic and dna studies done here have provided evidence for the settlement of north america by way of the bering land bridge.	the tlingit people developed a society with a matrilineal kinship system of property inheritance and descent in what is today southeast alaska, along with parts of british columbia and the yukon.	also in southeast were the haida, now well known for their unique arts.","4,4,4,4,4,4,3,3,4,4,4,4,3,3,4",3.7333333333333334
7401,1,es,in 1877 became the first well-known player to use a fielding kid gloves; these were between products sold in its sporting goods.,"albert goodwill spalding (september 2, 1849	– september 9, 1915) was an american pitcher, manager and executive in the early years of professional baseball, and the co-founder of a.g. spalding sporting goods company.	he played major league baseball between 1871 and 1878.","3,2,2,3,3,3,2,3,2,3,3,2,3,3,3,2,2",2.588235294117647
7481,1,fr,"it is now appreciated that most or all gene loci are highly polymorphic, with many alleles frequencies, which vary from population of the population, and that many of genetic diversity is hidden in the form of alleles which do not produce clear phenotypic differences.","the term ""wild type"" allele is sometimes used to describe an allele that is thought to contribute to the typical phenotypic character as seen in ""wild"" populations of organisms, such as fruit flies (""drosophila melanogaster"").	such a ""wild type"" allele was historically regarded as dominant, common, and normal, in contrast to ""mutant"" alleles regarded as recessive, rare, and frequently deleterious.	it was formerly thought that most individuals were homozygous for the ""wild type"" allele at most gene loci, and that any alternative ""mutant"" allele was found in homozygous form in a small minority of ""affected"" individuals, often as genetic diseases, and more frequently in heterozygous form in ""carriers"" for the mutant allele.","2,3,3,4,3,4,3,3,3,3,3,4,3,4,2,3,4,3",3.1666666666666665
7534,1,de,"there is no proof that bin laden 'al-qaeda' on behalf of a group until after the attacks of 11 september, when he said that the concept of the americans.",but there was no organization.	these were militants who mostly planned their own operations and looked to bin laden for funding and assistance.	he was not their commander.,"2,1,1,2,1,2,2,2,2,2,1,1,2,1,2,1,2",1.588235294117647
7536,1,cs,"this is described as a group, and it was therefore easier to prosecute any person associated with al-qaeda for all the acts or statements bin laden.","there were selective portions of al-fadl's testimony that i believe was false, to help support the picture that he helped the americans join together.	i think he lied in a number of specific testimony about a unified image of what this organization was.	it made al-qaeda the new mafia or the new communists.","3,2,3,3,4,3,3,4,4,4,4,4,2,3,4,4,2,4",3.3333333333333335
7547,1,fr,"in a december 2007 video, al-zawahiri defended the Islamic State iraq, but rejected the attacks against civilians committed by 'hypocrites and traitors existing between the ranks. ""","al-qaeda is sunni, and often attacked the iraqi shia majority in an attempt to incite sectarian violence and greater chaos in the country.	al-zarqawi purportedly declared an all-out war on shiites while claiming responsibility for shiite mosque bombings.	the same month, a statement claiming to be by aqi rejected as ""fake"" a letter allegedly written by al-zawahiri, in which he appears to question the insurgents' tactic of indiscriminately attacking shiites in iraq.","4,4,4,4,4,4,4,4,4,4,4,4,4,4,4,4",4.0
7605,1,cs,many of the chinese was so successful traders in small towns that were able to education their children in the college of commissioners.,"after reconstruction, the state began to receive more immigrants and migrants.	chinese, italian, and syrian men were recruited for farm labor in the developing delta region.	none of these nationalities stayed long at farm labor; the chinese especially quickly became small merchants in towns around the delta.","2,2,2,3,1,3,3,2,1,4,3,2,2,1,3,3,3",2.3529411764705883
7637,1,cs,"democrats are mostly concentrated on central little rock, mississippi delta, pine a sham, and the areas to the south of the border with louisiana.","most republican strength traditionally lied mainly in the northwestern part of the state, particularly fort smith and bentonville, as well as north central arkansas around the mountain home area.	in the latter area, republicans have been known to get 90 percent or more of the vote, while the rest of the state was more democratic.	after 2010, republican strength expanded further to the northeast and southwest and into the little rock suburbs.","4,4,4,3,3,4,3,3,3,4,4,3,3,3,4",3.466666666666667
7841,1,es,"more precisely, brightness varies inversely with the place of distance.","as the amount of light received actually depends on the thickness of the earth's atmosphere in the line of sight to the object, the apparent magnitudes are adjusted to the value they would have in the absence of the atmosphere.	the dimmer an object appears, the higher the numerical value given to its apparent magnitude.	note that brightness varies with distance; an extremely bright object may appear quite dim, if it is far away.","4,4,4,3,3,4,3,3,4,3,3,3,4,3,4,4,3,3,4,3",3.45
7892,0,en,"later analysis, using the pictures that they took, determined that they had come within an estimated of the crater's rim.","the second moonwalk, or eva, was intended to reach the rim of the wide cone crater.	however, the two astronauts were not able to find the rim amid the rolling terrain of the crater's slopes.	they became physically exhausted from the attempt and with their suits' oxygen supplies starting to run low, the effort was called off.","3,3,3,3,3,3,3,3,3,3,3,3,3,3,3",3.0
7908,1,es,"updated backpacks allowed longer-duration moonwalks, and the command module pilot, wearing a suit with three interconnectors, would lead to a five-connector version of the old moon suit — the liquid of cooling water connector be removed, as the command module would be a pilot 'deep-space eva' to restore film cartridges in the flight home.","on all previous apollo flights, including the non-lunar flights, the commander and lunar module pilot had worn suits with the life support, liquid cooling, and communications connections in two parallel rows of three.	on apollo 15, the new suits, dubbed the ""a7lb,"" had the connectors situated in triangular pairs.	this new arrangement, along with the relocation of the entry zipper (which went in an up-down motion on the old suits), from the right shoulder to the left hip, allowed the inclusion of a new waist joint, allowing the astronauts to bend completely over and to sit on the rover.","2,2,4,4,3,3,3,3,3,3,3,3,3,4,3,3,2,3",3.0
7954,1,cs,"the war later turned to south america, where british captured army in south carolina, but not enough volunteers from loyal civilians to take effective control.","the british were forced out of boston in 1776, but then captured and held new york city for the duration of the war.	the british blockaded the ports and captured other cities for brief periods, but failed to defeat washington's forces.	in early 1778, following a failed patriot invasion of canada, a british army was captured at the battle of saratoga, following which the french openly entered the war as allies of the united states.","3,3,2,2,3,2,3,3,3,2,2,2,2,3,3,3,3,3",2.611111111111111
8044,0,en,sirius lies less than a degree from betelgeuse in the otherwise unmodified orion and is with − 1.2 a little fainter than from earth but still the brightest star in the alpha centauri sky.,"the sun would be a yellow star of an apparent visual magnitude of +0.5 in eastern cassiopeia, at the antipodal point of alpha centauri's current right ascension and declination, at (2000).	this place is close to the 3.4-magnitude star ε cassiopeiae.	an interstellar or alien observer would find the \/\/ of cassiopeia had become a /\/\/ shape nearly in front of the heart nebula in cassiopeia.","4,3,3,3,3,2,3,3,4,3,3,3,4,3,2,4,4,3,3,2",3.1
8114,1,de,"lamar mirabeau b, second president of the newly formed republic texas, the commissioners to investigate the matter, the waterloo in the world, waterways and pleasant surroundings.","in 1835–1836, texans fought and won independence from mexico.	texas thus became its own independent country with its own president, congress, and monetary system.	in 1839, the texas congress formed a commission to seek a site for a new capital to be named for stephen f. austin.","1,1,2,2,2,2,2,1,1,2,2,1,1,2,2,1,2",1.588235294117647
8118,1,es,"the growth generated by this expansion in large measure adopted by austin at first, with the city away from the fourth largest to tenth more in texas between 1880 and 1920.","in 1940, the destroyed granite dam on the colorado river was finally replaced by a hollow concrete dam that formed lake mcdonald (now called lake austin) and which has withstood all floods since.	in addition, the much larger mansfield dam was built by the lcra upstream of austin to form the flood-control lake, lake travis.	in the early 20th century, the texas oil boom took hold, creating tremendous economic opportunities in southeast texas and north texas.","1,1,4,2,3,2,4,3,3,2,3,2,2,2,2,3,3,3",2.5
812,1,es,the soil to restore its refitting of nutrients lost over the use of techniques of agriculture of monoculture also takes time.,"some studies using modern organic-farming methods have reported yields as high as those available from conventional farming.	in the aftermath of the fall of the soviet union, with shortages of conventional petroleum-based inputs, cuba made use of mostly organic practices, including biopesticides, plant-based pesticides and sustainable cropping practices, to feed its populace.	however, organic farming may be more labor-intensive and would require a shift of the workforce from urban to rural areas.","2,2,1,3,3,3,1,2,4,2,4,1,3,3,4,3,3",2.588235294117647
8197,1,de,"auschwitz was also limits to their destructive options. ""","shortly following the camp's liberation, the soviet government stated that four million people had been killed on the site, a figure now regarded as greatly exaggerated.	while under interrogation, höss said that adolf eichmann told him that two and a half million jews had been killed in gas chambers and about half a million more had died of other causes.	later he wrote, ""i regard the figure of two and a half million as far too high.","2,3,2,1,1,2,1,3,2,3,2,1,3,2,2,2,2",2.0
8203,1,de,"the number of remaining survivors every year, participation in the event is not in future be exceeded important anniversaries.","the flight was led by major-general amir eshel, the son of holocaust survivors.	on january 27, 2015, some 300 auschwitz survivors and other guests gathered under a giant tent at the entrance to auschwitz ii birkenau to commemorate the 70th anniversary of the camp's liberation.	attendees included president of the world jewish congress ronald lauder, film director steven spielberg, and world leaders such as polish president bronisław komorowski and king willem-alexander of the netherlands.","1,1,3.0,3,2,1,2,1,1,2,1,3,1,2,3,3,3,2",1.9444444444444444
841,1,cs,three or more resources (groups or variables) for statistical importance.,"in the anova setting, the observed variance in a particular variable is partitioned into components attributable to different sources of variation.	in its simplest form, anova provides a statistical test of whether or not the means of several groups are equal, and therefore generalizes the ""t""-test to more than two groups.	as doing multiple two-sample t-tests would result in an increased chance of committing a statistical type i error, anovas are useful for comparing (testing)","3,3,2,4,4,2,4,2,4,3,3,3,3,3,4,3,4,4,4",3.263157894736842
8460,1,cs,"as soon as the loosed couple, ares at a loss, be repatriated, thrace and aphrodite into paphos.","but hephaestus was not satisfied with his revenge, so he invited the olympian gods and goddesses to view the unfortunate pair.	for the sake of modesty, the goddesses demurred, but the male gods went to witness the sight.	some commented on the beauty of aphrodite, others remarked that they would eagerly trade places with ares, but all who were present mocked the two.","2,1,2,2,1,1,1,1,1,1,1,1,1,2,1,2,1,1",1.2777777777777777
8586,1,de,"in addition to these liberals and left-wing efforts, of a small group of the conservative institutions were born in ann arbor.","during the ensuing 15 years, many countercultural and new left enterprises sprang up and developed large constituencies within the city.	these influences washed into municipal politics during the early and mid-1970s when three members of the human rights party (hrp) won city council seats on the strength of the student vote.	during their time on the council, hrp representatives fought for measures including pioneering antidiscrimination ordinances, measures decriminalizing marijuana possession, and a rent-control ordinance; many of these remain in effect in modified form.","3,3,4,3.0,4,4,4,3,3,3,3,4,3,3,4,2,4,3,2",3.263157894736842
8619,0,en,"further, as the current monarch's eldest child and, in turn, his eldest child, are anglican males, any change to the succession laws would have no immediate implications.","challenges have been made against the act of settlement, especially its provisions regarding roman catholics and preference for males.	however, legislating for alterations to the act is a complex process, since the act is a common denominator in the shared succession of all the commonwealth realms.	the statute of westminster 1931 acknowledges by established convention that any changes to the rules of succession may be made only with the agreement of all of the states involved, with concurrent amendments to be made by each state's parliament or parliaments.","2,4,4,3,2,4,4,3,4,4,4,3,4,3,4,3,2",3.3529411764705883
8697,1,cs,"the whole of this reading is now questionable, as some have argued that the treaty of lisbon in question may not with king tudiya from assyria, but rather with unnamed king precarious instead of the so-called 'abarsal'.","of the early history of the kingdom of assyria, little is positively known.	in the assyrian king list, the earliest king recorded was tudiya.	in archaeological reports from ebla, it appeared that tudiya's activities were confirmed with the discovery of a tablet where he concluded a treaty for the operation of a ""karum"" (trading colony) in eblaite territory, with ""king"" ibrium of ebla (who is now known to have been the vizier of ebla for king ishar-damu).","2,3,4,3.0,3,4,2,3,2,3,2,4,2,4,3,4,3,3,3",3.0
