ID,translated,source-language,sentence,context,full-ratings,mean-ratings
10037,1,es,"in its document entitled ""ethics of the economy '(1999) which addresses issues such as equality, justice and useful.","his book ""weighing goods"" (1991) explores the way in which goods ""located"" in each of the three ""dimensions"" — time, people, states of nature—make up overall goodness.	broome argues that these dimensions are linked by what he calls the ""interpersonal addition theorem"", which supports the utilitarian principle of distribution.	in his book ""weighing lives"" (2004), broome rejects the presumed intuition that adding people to the population is ethically neutral.","2,3,3,2,2,3,2,3,2,3,3,4,2,2,3,3,4,2",2.6666666666666665
10213,0,en,stokes started his time at bramall lane as a first team regular but was soon dropped to the bench and returned to sunderland having made twelve appearances but failed to score a goal.,"on 17 october 2008, stokes agreed a three-month loan deal to sheffield united, with the possibility of extending it for the season.	stokes again took the shirt that was previously vacated by jon stead, this time number 8.	stokes made his debut for the blades in the local derby against sheffield wednesday a few days later, coming on as a second-half substitute.","4,4,3,4,3,3,4,4,4,4,4,4,4,3,3,3,4,4,4",3.6842105263157894
10286,1,cs,"as a result, it is used in cosmetics perfumery and for his maintain, and in flavorings say, apple and pear flavors.","benzyl acetate is found naturally in many flowers.	it is the primary constituent of the essential oils from the flowers jasmine, ylang-ylang and tobira.	it has pleasant sweet aroma reminiscent of jasmine.","2,2,3,2,2,3,2,3,1,2,3,1,3,2,3,2,3",2.2941176470588234
10332,1,cs,"the fact that in the period garnett 24 games in atlanta, including the election results 17 directly games of 24 november 28, in december 2005.","garnett was called up to the thrashers early in the 2005–06 season due to a groin injury sustained by thrashers starting goaltender kari lehtonen.	garnett made his nhl debut on october 12, 2005, when he replaced mike dunham, who suffered a groin injury less than ten minutes into a game against the montreal canadiens.	the thrashers lost the game 2-0, though garnett stopped 29 of the 30 shots he faced and was named the game's second star.","1,1,2,2,2,1,1,1,1,1,1,1,2,2,1,1,2",1.3529411764705883
1037,1,es,"in 1988, abdul ahad mohmand became the first afghan to reach space, the expenditure nine days on the mir space station.","in april 1985, taylor wang became the first ethnic chinese person in space.	the first person born in africa to fly in space was patrick baudry (france), in 1985.	in 1985, saudi arabian prince sultan bin salman bin abdulaziz al-saud became the first arab muslim astronaut in space.","3,3,3,4,3,3,2,3,2,3,3,3,4,4,4,3,4,2,3,2",3.05
10373,1,es,during this time has been transformed into a school two-year four-year a college with a masters course programme.,"in 1974, the name was changed to the college of boca raton.	the college was granted accreditation at level ii in 1986.	in 1988, it was accredited at level iii.","1,1,2,3,3,2,2,2,3,2,3,1,3,1,3,3,3,3,1,1",2.15
10424,1,es,the actor can interact with the clouds while flying horizontally.,"""cloud"", a single-player video game for microsoft windows, centers on a boy who dreams of flying through the sky while asleep in a hospital bed.	the player assumes control of the sleeping boy's avatar—the projection of the boy into his dream world—and guides him through his dream of a small group of islands with a light gathering of clouds.	the avatar's direction and speed are controlled with a mouse; movement is generally on a horizontal plane, but vertical flight can be attained by holding down the third button of the mouse.","3,4,4,4,4,4,4,4,4,4,4,4,4,4,4,4,4,4",3.9444444444444446
10448,0,en,she resigned from the idf in august 1983 to marry and finish her law studies.,"livni served in the idf, gaining rank of lieutenant.	livni later served in the mossad during 1980 and 1984, between the ages of 22 and 26.	according to an interview in yediot aharonot, described in ""the sunday times"", she served in the elite unit responsible for operation wrath of god.","4,4,3,4,4,4,3,3,4,4,4,4,4,4,4,4,3.0",3.764705882352941
10508,0,en,"later additional burials and cremations were cut into the barrow, and it was enlarged twice.","the barnack burial is an important early bronze age find.	it comes from a complicated monument which was expanded and altered on at least three different occasions.	the original burial was very rich for the period, but was covered by only a small barrow.","4,3,4,4,3,4,3,4,4,3,3,3,3,4,3,4",3.5
10655,1,cs,"the dissipating the remnants of patsy continue eastwards across gulf during on 11 august, crossing back to mainland china and died over land, in august 12.","patsy retained typhoon status throughout the day, making landfall on hainan near the city of wenchang as a tropical storm with winds of 70 mph (110 km/h).	weakening as it crossed over china, the storm crossed along the southwestern shores of a nearby peninsula.	crossing through a gulf of the south china sea, patsy weakened to a 50 mph (85 km/h) tropical storm before the joint typhoon warning center ceased following the system on the morning of august 11, as it made landfall near the city of dianbai liaogang, china.","3,3,2,3,2,3,2,3,2,3,3,3,3,4,2,2,4,3",2.7777777777777777
10689,1,es,the strong winds karen eur 250 million in damage caused dollars dollars) (1962 and 11 deaths.,"it turned to the west, maintaining its powerful winds of 175–185 mph for 4 days as it crossed the islands of the west pacific.	cool air weakened karen as it turned to the north, and was only a minimal typhoon at its nearest approach to japan.	the storm turned eastward, where it became extratropical on november 18.","3,2,1,1,3,1,2,1,1,1,2,2,3,2,1,1,2,3,1,2",1.75
10697,0,en,"in march 2009 prosecutors in a philadelphia drug dealing case named buckhalter as a celebrity client of the alleged dealer, styles n. beckles.","buckhalter is a cousin of tampa bay buccaneers cornerback brandon mcdonald.	buckhalter has had to deal with adversity over his career.	his mother died when he was young and his brother chris, who played on the eagles practice squad in 1996, is serving a 20-year sentence for manslaughter.","4,4,2,3,4,4,2,2,4,4,4,4,4,3,3,3,4",3.411764705882353
1074,1,de,"in addition to the alkali metal amide salt and solvated electrons, ammonia solutions include the alkali metal cation (m +), the neutral alkali metal nuclear (m), diatomic alkali metal compounds (m2) and alkali metal anions (m -).","the amide salt is quite insoluble and readily precipitates out of solution, leaving intensely coloured ammonia solutions of the alkali metals.	in 1907, charles krause identified the colour as being due to the presence of solvated electrons, which contribute to the high electrical conductivity of these solutions.	at low concentrations (below 3 m), the solution is dark blue and has ten times the conductivity of aqueous sodium chloride; at higher concentrations (above 3 m), the solution is copper-coloured and has approximately the conductivity of liquid metals like mercury.","3,4,2,4,4,3,4,3,4,4,3,2,4,2,4,4,3,3",3.3333333333333335
1075,1,cs,"to use as a basis, butyllithiums are often used and are commercially available.","being the smallest alkali metal, lithium forms the widest variety of and most stable organometallic compounds, which are bonded covalently.	organolithium compounds are electrically non-conducting volatile solids or liquids that melt at low temperatures, and tend to form oligomers with the structure (rli)""x"" where r is the organic group.	as the electropositive nature of lithium puts most of the charge density of the bond on the carbon atom, effectively creating a carbanion, organolithium compounds are extremely powerful bases and nucleophiles.","3,2,4,4,3,2,4,3,3,4,4,4,4,4,2,3,4,3,3",3.3157894736842106
10836,1,es,the southern agreement to be brought before the people on an impressive stone viaduct which is highest (one of several such structures in the map).,"denby dale railway station serves the village of denby dale, in west yorkshire, england and the surrounding area.	it lies on the penistone line south east of huddersfield and is operated by northern rail.	opened by the huddersfield & sheffield junction railway in 1850 (which subsequently became part of the lancashire & yorkshire railway), it originally had two platforms but lost the northbound one when the clayton west junction to penistone section was singled in 1969.","1,1,2,3,3,2,3,3,2,2,3,4,4,2,2,2,3,1,1,2",2.3
10844,1,de,"in a week 12 game against the new england patriots, reed mentioned the describe as the security position if sean considine and quintin mikell not because of violations.","this led to his subsequent release and the eagles' signing of reno mahe.	however, he was re-signed within weeks to back up injured all-pro safety brian dawkins.	reed has since returned to the eagles' special teams and has resumed his role of kick returner.","2,2,2,1,2,1,3,2,2,2,3,1,1,4,4,1,3,3,1",2.1052631578947367
10860,1,cs,"in september 15, carmen achieved landfall in southern china and dispelled the following day.","carmen headed south briefly before heading east-northeast, when it began to strengthen even more.	carmen reached winds of 125 mph and a pressure of 960 mbar.	but shortly thereafter, the strengthening stopped, and it slowly weakened.","4,4,4,4,4,4,4,3,3,3,4,3,4,3,4,4,4,3,3,3",3.6
10894,1,fr,"on the basis of 'memories of 2', the main series of gambling offers the possibility of multiple endings for each of the heroines.","the gameplay of memories off follows the style of most visual novels; the majority of time spent playing the game is spent on reading through the dialogue or story that appears on screen.	every so often, the game will pause and the player is given a chance to choose from two to five options regarding how he or she wishes to advance the game.	the plot will then branch into paths focusing on a single heroine depending on the choices that were made by the player; a conclusive character ending will be presented at the end of any given path.","4,3,4,3,3,3,3,3,4,3,3,3,3,3,3,3,4,4",3.2777777777777777
1090,1,fr,"no attempt of synthesis were made for any of metals chlor-alkali as unhexpentium, due to the large number of nuclear.","it is highly unlikely that this reaction will be able to create any atoms of ununennium in the near future, given the extremely difficult task of making sufficient amounts of 254es, which is favoured for production of ultraheavy elements because of its large mass, relatively long half-life of 270 days, and availability in significant amounts of several micrograms, to make a large enough target to increase the sensitivity of the experiment to the required level; einsteinium has not been found in nature and has only been produced in laboratories.	however, given that ununennium is only the first period 8 element on the extended periodic table, it may well be discovered in the near future through other reactions; indeed, another attempt to synthesise ununennium by bombarding a berkelium target with titanium ions is under way at the gsi helmholtz centre for heavy ion research in darmstadt, germany.	currently, none of the period 8 elements have been discovered yet, and it is also possible, due to drip instabilities, that only the lower period 8 elements, up to around element 128, are physically possible.","2,2,4,3.0,2,3,2,4,2,2,1,4,2,2,3,3,3,3,4",2.6842105263157894
10907,1,de,"it is also in the media, feng shui, different cultures and different trading venues and green dragon and avalon dragon.",the azure dragon is one of the four symbols of the chinese constellations.	it represents the east and the spring season.	it should not be confused with the mythological yellow dragon that is associated with the emperor of china.,"1,2,1,3,1,1,1,2,3,2,4,4,3,3,3,1,2",2.176470588235294
110,1,de,"in 2010, per capita income for the state of dollars 22,984.","according to the u.s. bureau of economic analysis, the 2008 total gross state product was $170 billion, or $29,411 per capita.	alabama's 2012 gdp increased 1.2% from the previous year.	the single largest increase came in the area of information.","1,1,3,3,1,3,2,3,3,2,3,1,2,2,2,2",2.125
11029,0,en,"it took the combined weight of mercury, may and taylor to persuade him.","as soon as steve howe went into the studios, mercury asked him to play some guitar (according to producer david richards, who had worked with yes in the past as well).	another version is that brian may was the one who asked him to play the flamenco bit.	when the members of queen asked if howe wanted to play on the title track, howe politely suggested they’d lost their minds.","4,4,4,4,3,4,4,4,3,4,3,4,4,4,4,3,4,4",3.7777777777777777
1105,1,fr,"a third type, called abugida or alphasyllabary, where vowels have shown by diacritics or changes to basis consonantal letters, as devanagari and other south asian paperwork.","according to terminology introduced by peter t. daniels, an ""alphabet"" in the narrow sense is one that represents both vowels and consonants as letters equally.	the first ""true alphabet"" in this sense was the greek alphabet, which was developed on the basis of the earlier phoenician alphabet.	in other alphabetic scripts, such as the original phoenician, hebrew or arabic, letters predominantly or exclusively represent only consonants; such a script is also called an abjad.","3,2,3,2,2,2,2,2,3,3,2,2,4,3,4,2,3,3",2.611111111111111
11168,1,es,the three plead before.,"the jury acquitted millard fillmore ball and convicted john c. ball and robert e. boutwell.	the convicted defendants appealed to the supreme court, which reversed their convictions in 1891, holding that the indictment was insufficient.	all three were indicted for the murder a second time.","2,4,1,3,2,1,3,2,2,2,3,4,2,4,4,4,2.0",2.6470588235294117
11183,0,en,"the government is responsible only to parliament, specifically the people ’ s assembly.","the government has a leading role in shaping the agenda of the houses of parliament.	it may propose laws to parliament, as well as amendments during parliamentary meetings.	it may make use of some procedures to speed up parliamentary deliberations.","4,3,4,3,3,4,4,4,4,4,4,3,4,4,3,4,3,3,3,4",3.6
11413,1,de,"well-known american and italian artists in the 20th century, also in the collection.",the in kurashiki was the first collection of western art to be permanently exhibited in japan.	the museum opened in 1930 and originally consisted almost entirely of french paintings and sculptures of the 19th and 20th centuries.	the collection has now expanded to include paintings of the italian renaissance and of the dutch and flemish 17th century.,"3,3,3,3,3,2,2,3,3,4,2,3,2,3,4,3,2",2.823529411764706
11570,1,es,appear (the time bad that monarch was transformed into) aimed at the whole team titans attacking the heroes who were trying to undo this time of crisis.,"he created the false future world so he could train meta-humans (the team titans) to act as sleeper agent assassins.	he brought various super-powered beings from alternate realities and trained them as team titans.	he knew of the impending time crisis, and wanted a super-powered army at his command.","2,3,1,2,2,3,1,2,1,1,2,2,2,2,1,3,3,2",1.9444444444444444
11579,1,es,some of the houses are on holiday allows.,"bawdeswell is a small rural village and civil parish in the breckland district of the county of norfolk, england.	at the time of the 2011 census it had a population of 828 and an area of 487 hectares.	as of june 2012 there were 360 dwellings with some 314 in the village itself and a further 46 within the parish boundary.","2,3,3,1,2,1,2,2,1,1,1,2,1,2,2,3,2,1",1.7777777777777777
11591,1,es,in the south of the a1067 is bawdeswell garage.,"as well as the pub, bawdeswell has a village shop which used to be privately owned but is now owned by mccolls, a butcher's shop	[currently closed] and a reasonably sized garden centre.	a post office is open on tuesday & friday mornings in the church vestry.","4,4,3,3,2,3,3,4,2,3,3,3,3,4,4,2,3,3,2",3.0526315789473686
1173,1,fr,"at the end of 1978, it has also written writing 'sardor' with the writer aleksandr misharin.","during 1975, tarkovsky also worked on the screenplay ""hoffmanniana"", about the german writer and poet e. t. a. hoffmann.	in december 1976, he directed ""hamlet"", his only stage play, at the lenkom theatre in moscow.	the main role was played by anatoly solonitsyn, who also acted in several of tarkovsky's films.","2,4,2,2,1,3,2,2,2,2,4,2,1,3,3,1,2,3",2.2777777777777777
11808,1,fr,"60-60 related to the end of the regulation and 73-73 at the end of the first overtime, it was cairns which has prevailed 85-81 to send the last number one third and decide game.",the breakers met the cairns taipans in the best-of-three grand final series that was to result in one of the teams winning their maiden nbl championship (it was also the first time that both teams had made the grand final).	the breakers coasted to an 85-67 win in game 1 after leading by as much as 31 in the third-quarter.	the teams then fought out a gripping game 2 in cairns.,"3,3,3,3,3,1,1,2,2,1,2,2,3,3,2,2,3,3,2",2.3157894736842106
11894,0,en,"nevertheless the cooler component (gamma2) is more massive than gamma1 and according to the hierarchy of masses and brightness, gamma2 should be the primary star of the system.","the star is thought to have about 7 times more luminosity than the sun.	the secondary star (gamma2 delphini) is an orange subgiant star of spectral type ""k1iv"" and an apparent magnitude of 4.27.	this star is thought to have about 20.6 times more luminosity than the sun.","4,4,3,3,3,4,4,4,3,3,4,4,3,3,3,3,4,3",3.4444444444444446
11895,1,cs,macey serves the academic advisory committee (comitato scientifico) associazione disiano preite for the study of company law (on lo studio del diritto dell ’ impresa).,"macey has taught at major universities throughout the world, including bocconi university (milan), the university of tokyo; the university of toronto; the university of turin, the university of amsterdam department of finance, and the stockholm school of economics, department of law.	he also has been professor of law at the university of chicago (1990) and visiting professor of law at harvard law school (1999).	macey is a senior research fellow at the international centre for economic research (icer) in turin, italy.","4,3,3,2,3,2,3,4,3,3,3,3,4,2,3,3",3.0
12056,1,de,"later handley, in the first concert in london, the symphony orchestra of morley college.","after graduating he worked as a nursery gardener, bricklayer and petrol pump attendant during the day, studying and conducting amateur orchestras and choirs in the evening.	he then became sir adrian boult's pupil.	during their first meeting he ""was put through the worst two hours of counterpoint and harmony that i've ever faced"" and was then asked how he would conduct a page of a score that boult put in front of him, sir arnold bax's third symphony, which handley happened to have studied.","1,2,1,2,2,2,1,2,2,3,1,3,3,1,2",1.8666666666666667
12112,1,cs,"the conducted extensive holidays in mexico, the netherlands, germany and spain for nearly three years.","laura flores had a hit single for her telenovela a grammy winning single ""el alma no tiene color	"" (""the soul has no color""), a duet with marco antonio solís.	her first taste of stardom came when she joined ""hermanos y amigos"", whose band members were her family.","2,3,3,3,2,2,3,2,3,3,3,3,3,3,3,2,3",2.7058823529411766
1214,1,fr,"recent studies have shown that the aardwolf probably for the whole of the family hyena right from the start, but how early is still unclear that fossil fuels and studies agreement of 10 million years.","the aardwolf is the only surviving species in the mammalian subfamily ""protelinae"".	there is disagreement as to whether the species is monotypic.	or can be divided into subspecies ""p. c. cristatus"" of southern africa and ""p. c. septentrionalis"" of east africa.","3,1,2,2,1,1,1,2,2,2,1,2,3,1,1,3,2,2,2,1",1.75
12165,0,en,"here, they recorded the more widely heard a-side.","based on the peel performance, rough trade label head geoff travis suggested that the band release the song as a single instead of the slated release ""reel around the fountain"", which had gathered notoriety in the press due to what were seen as lyrical references to paedophilia.	the smiths entered matrix studios in london on september 1983 to record a second studio version of the song for release as a single.	however, the result—known as the 'london version'—was unsatisfactory and soon after, the band travelled to strawberry studios in stockport to try again.","4,3,4,3,3,3,3,4,4,4,3,4,4,4,4,4,4,3",3.611111111111111
12302,1,fr,"finally, petraeus pleaded guilty to a misdemeanor accusations of mismanagement classified information.","petraeus relinquished command of u.s. and nato forces in afghanistan on july 18, 2011, and retired from the u.s. army on august 31, 2011.	on november 9, 2012, general petraeus resigned from his position as director of the cia, citing his extramarital affair which was reportedly discovered in the course of an fbi investigation.	in january 2015, officials reported the fbi and justice department prosecutors had recommended bringing felony charges against petraeus for allegedly providing classified information to his mistress while serving as the director of the cia.","2,3,4,4,2,3,4,4,4,3,2,3,3,4,4,3,3,3",3.2222222222222223
12359,1,cs,"previously, local time was intended astronomical comments in hong kong observatory through 6-inch lee equatorial and 3-inch transit circle.","hong kong maintains its own time authority after transfer of sovereignty in 1997.	the hong kong time () is all year round, without daylight saving observation.	greenwich mean time was adopted as the basis in 1904, and utc was adopted as a standard in 1972.","1,1,2,3,2,3,1,1,2,2,1,2,1,3,3,3,2,3",2.0
12388,1,cs,universities is known for its prestige programme pharmacies.,"the department of desalination was established on 1995 by riyad hassan el-khoudary.	the water research center is an independent non-government palestinian institution.	in the late 1990s, the university opened a school of medicine in collaboration with abu-dis university in jerusalem.","3,2,3,2,3,2,3,3,2,2,3,2,3,2,2,2,2",2.411764705882353
1242,1,fr,"while the urban towns were more technologically advanced and socially, in many cases, they could do little to a military aspect to defend against the rise of hordes of the steppe.",the center and the peripheries were mostly kept separated by mountains and deserts.	the caucasus and himalaya mountains and the karakum and gobi	deserts formed barriers that the steppe horsemen could cross only with difficulty.,"3,3,3,3,3,3,3,3,3,3,3,3,3",3.0
12458,1,de,"the use of egyptologists controversial, but the situation of these reservoirs under the sun, proposes ritual practices which shed some light on the role of this monument.","finally the last element essential to the funerary cult, the satellite-pyramid encircled in its own peribolos, is located southeast of the royal pyramid and therefore was accessible only through a corridor of stores and halls of worship.	this small pyramid covers an underground plan consisting of a short ramp leading to a single underground chamber.	in the middle of the courtyard of the paribolos, facing east and west, are two landscaped basins in the granite floor.","2,2,3,3,3,3,3,3,3,2,3,2,2,2,2,2,2,3",2.5
12627,1,de,"he complained to church but not spent, and their time helmets, drinking water, singing and dancing, after pagan rituals.","jaanipäev was celebrated long before the arrival of christianity in estonia, although the day was given its name by the crusaders.	the arrival of christianity, however, did not end pagan beliefs and fertility rituals surrounding this holiday.	in 1578, with some disgust, balthasar russow wrote in his ""livonian chronicle"" about estonians who placed more importance on the festival than going to church.","2,1,1,1,1,2,2,2,1,1,1,1,1,1,2,1",1.3125
12658,1,de,"on 22 november 545, pope vigilius celebrated the feast of the holy in the church, if the emissary of empress theodora, anthemius scribo, arrested.","tradition holds that the church was built over the house of the saint.	the baptistery associated with this church, together with the remains of a roman house of the early empire, was found during some excavations under the chapel of the relics.	by the late fifth century, at the synod of 499 of pope symmachus, the church is mentioned as the ""titulus ceciliae"".","1,3,3,3,2,2,3,2,1,2,2,3,2,2,3,1,3,3,2",2.263157894736842
12703,1,es,"when katie discovers declan had ceased its horses of the stables and on the people who get gordon adam help round of new and apology for the use of him, but its forgives and shows that do not mind as he has drawn to it.","katie is shocked to discover declan had ordered his secretary nicola king (nicola wheeler) spy on her.	later, katie walks in on declan flirting with two girls he had met at the launch, erica and helen in order to make her jealous.	katie tells him that she hates him and wanted a divorce, throwing her wedding ring at him.","1,2,1,3,1,2,2,1,1,2,2,1,1,2,3,2,2,1",1.6666666666666667
12889,0,en,he was the father of major league coach dom chiti.,"harry chiti (pronounced ) (november 16, 1932 – january 31, 2002) was an american catcher in major league baseball.	from 1950 through 1962, he played for the chicago cubs, kansas city athletics, detroit tigers and new york mets.	chiti batted and threw right-handed.","4,4,4,3,4,4,4,4,4,4,4,4,3,4,3,3",3.75
